text,source,category,type,timestamp
"hootner live stream gaming session","platform","video","video_content","2026-01-01T23:07:33.346Z"
"tutorial how to use video editor","platform","video","video_content","2026-01-01T23:07:33.348Z"
"music performance live concert","platform","general","video_content","2026-01-01T23:07:33.348Z"
"coding tutorial javascript basics","platform","general","video_content","2026-01-01T23:07:33.348Z"
"product review tech gadgets","platform","general","video_content","2026-01-01T23:07:33.348Z"
"welcome to hootner platform where creators share amazing content","platform","social","video_content","2026-01-01T23:07:33.348Z"
"this video shows how to build web applications using modern frameworks","platform","tutorial","video_content","2026-01-01T23:07:33.348Z"
"live music performance featuring original compositions","platform","systems","video_content","2026-01-01T23:07:33.348Z"
"learn programming fundamentals step by step","platform","general","video_content","2026-01-01T23:07:33.348Z"
"comprehensive review of latest technology products","platform","general","video_content","2026-01-01T23:07:33.348Z"
"great video thanks for sharing","platform","video","video_content","2026-01-01T23:07:33.348Z"
"this helped me understand the concept","platform","general","video_content","2026-01-01T23:07:33.348Z"
"amazing content keep it up","platform","general","video_content","2026-01-01T23:07:33.348Z"
"can you make more tutorials like this","platform","social","video_content","2026-01-01T23:07:33.348Z"
"subscribed and looking forward to more","platform","social","video_content","2026-01-01T23:07:33.348Z"
"hello everyone welcome to the stream","platform","video","video_content","2026-01-01T23:07:33.348Z"
"what video should i watch next","platform","video","video_content","2026-01-01T23:07:33.348Z"
"the platform is really fast and smooth","platform","general","video_content","2026-01-01T23:07:33.348Z"
"love the new features you added","platform","general","video_content","2026-01-01T23:07:33.348Z"
"how do i upload my own videos","platform","systems","video_content","2026-01-01T23:07:33.348Z"
"hootner is the ultimate video streaming platform that never sleeps.","platform","video","video_content","2026-01-01T23:07:33.348Z"
"the owl watches over your content day and night.","platform","video","video_content","2026-01-01T23:07:33.348Z"
"upload videos and share them with the world instantly.","platform","systems","video_content","2026-01-01T23:07:33.348Z"
"real-time collaboration makes content creation seamless.","platform","ai","video_content","2026-01-01T23:07:33.348Z"
"our microservices architecture ensures high availability.","platform","systems","video_content","2026-01-01T23:07:33.348Z"
"kubernetes orchestration provides automatic scaling.","platform","general","video_content","2026-01-01T23:07:33.348Z"
"machine learning powers intelligent video recommendations.","platform","ai","video_content","2026-01-01T23:07:33.348Z"
"artificial intelligence moderates content automatically.","platform","general","video_content","2026-01-01T23:07:33.348Z"
"users can chat and interact in real-time.","platform","general","video_content","2026-01-01T23:07:33.348Z"
"the platform supports live streaming and video on demand.","platform","video","video_content","2026-01-01T23:07:33.348Z"
"security is built into every layer of the system.","platform","security","video_content","2026-01-01T23:07:33.348Z"
"monitoring and observability ensure reliability.","platform","general","video_content","2026-01-01T23:07:33.348Z"
"blue-green deployments enable zero downtime updates.","platform","general","video_content","2026-01-01T23:07:33.348Z"
"chaos engineering tests system resilience continuously.","platform","systems","video_content","2026-01-01T23:07:33.349Z"
"automated backups protect your valuable content.","platform","general","video_content","2026-01-01T23:07:33.349Z"
"multi-region sync provides disaster recovery.","platform","general","video_content","2026-01-01T23:07:33.349Z"
"the marketplace offers digital goods and services.","platform","general","video_content","2026-01-01T23:07:33.349Z"
"analytics dashboards show real-time metrics.","platform","general","video_content","2026-01-01T23:07:33.349Z"
"search functionality helps discover great content.","platform","general","video_content","2026-01-01T23:07:33.349Z"
"the code editor enables in-browser development.","platform","tutorial","video_content","2026-01-01T23:07:33.349Z"
"moderation tools keep the community safe.","platform","general","video_content","2026-01-01T23:07:33.349Z"
"messaging features connect users instantly.","platform","general","video_content","2026-01-01T23:07:33.349Z"
"profile management gives users full control.","platform","general","video_content","2026-01-01T23:07:33.349Z"
"settings allow deep customization options.","platform","general","video_content","2026-01-01T23:07:33.349Z"
"the jukebox player provides unique video experience.","platform","video","video_content","2026-01-01T23:07:33.349Z"
"offline caching enables viewing without internet.","platform","general","video_content","2026-01-01T23:07:33.349Z"
"pwa installation makes it feel like native app.","platform","social","video_content","2026-01-01T23:07:33.349Z"
"audio effects add creative possibilities.","platform","systems","video_content","2026-01-01T23:07:33.349Z"
"share api integration enables easy content sharing.","platform","networking","video_content","2026-01-01T23:07:33.349Z"
"touch and swipe navigation feels natural.","platform","general","video_content","2026-01-01T23:07:33.349Z"
"keyboard shortcuts boost productivity.","platform","systems","video_content","2026-01-01T23:07:33.349Z"
"the dashboard shows comprehensive overview.","platform","general","video_content","2026-01-01T23:07:33.349Z"
"social feed keeps you connected with community.","platform","general","video_content","2026-01-01T23:07:33.349Z"
"payment processing is secure and reliable.","platform","general","video_content","2026-01-01T23:07:33.349Z"
"graphql api provides flexible data access.","platform","networking","video_content","2026-01-01T23:07:33.349Z"
"rest endpoints enable easy integration.","platform","general","video_content","2026-01-01T23:07:33.349Z"
"websocket connections power real-time features.","platform","general","video_content","2026-01-01T23:07:33.349Z"
"redis caching improves performance significantly.","platform","data","video_content","2026-01-01T23:07:33.349Z"
"mongodb stores data efficiently and reliably.","platform","general","video_content","2026-01-01T23:07:33.349Z"
"prometheus collects detailed metrics continuously.","platform","ai","video_content","2026-01-01T23:07:33.349Z"
"grafana visualizes system health beautifully.","platform","general","video_content","2026-01-01T23:07:33.349Z"
"istio service mesh manages traffic intelligently.","platform","general","video_content","2026-01-01T23:07:33.349Z"
"traefik routes requests efficiently.","platform","general","video_content","2026-01-01T23:07:33.349Z"
"docker containers ensure consistent deployments.","platform","ai","video_content","2026-01-01T23:07:33.349Z"
"ci cd pipelines automate the entire workflow.","platform","general","video_content","2026-01-01T23:07:33.349Z"
"github actions handle testing and deployment.","platform","general","video_content","2026-01-01T23:07:33.349Z"
"security scanning catches vulnerabilities early.","platform","security","video_content","2026-01-01T23:07:33.349Z"
"rate limiting protects against abuse.","platform","ai","video_content","2026-01-01T23:07:33.349Z"
"cors protection secures cross-origin requests.","platform","systems","video_content","2026-01-01T23:07:33.349Z"
"csp headers prevent injection attacks.","platform","general","video_content","2026-01-01T23:07:33.349Z"
"jwt authentication keeps users secure.","platform","security","video_content","2026-01-01T23:07:33.349Z"
"firebase integration simplifies user management.","platform","general","video_content","2026-01-01T23:07:33.349Z"
"stripe handles payment processing reliably.","platform","general","video_content","2026-01-01T23:07:33.349Z"
"aws s3 stores media files efficiently.","platform","general","video_content","2026-01-01T23:07:33.349Z"
"the system scales horizontally with demand.","platform","general","video_content","2026-01-01T23:07:33.349Z"
"load balancing distributes traffic evenly.","platform","general","video_content","2026-01-01T23:07:33.349Z"
"circuit breakers prevent cascade failures.","platform","ai","video_content","2026-01-01T23:07:33.349Z"
"retry logic handles transient errors gracefully.","platform","general","video_content","2026-01-01T23:07:33.349Z"
"bulkhead pattern isolates failures effectively.","platform","ai","video_content","2026-01-01T23:07:33.349Z"
"graceful shutdown ensures clean termination.","platform","general","video_content","2026-01-01T23:07:33.349Z"
"health checks monitor service status.","platform","general","video_content","2026-01-01T23:07:33.349Z"
"log aggregation centralizes troubleshooting.","platform","general","video_content","2026-01-01T23:07:33.349Z"
"error tracking catches issues quickly.","platform","general","video_content","2026-01-01T23:07:33.349Z"
"performance monitoring identifies bottlenecks.","platform","general","video_content","2026-01-01T23:07:33.349Z"
"user analytics guide product decisions.","platform","general","video_content","2026-01-01T23:07:33.349Z"
"content delivery network speeds up access.","platform","networking","video_content","2026-01-01T23:07:33.349Z"
"image optimization reduces bandwidth usage.","platform","general","video_content","2026-01-01T23:07:33.349Z"
"video transcoding supports multiple formats.","platform","video","video_content","2026-01-01T23:07:33.349Z"
"thumbnail generation happens automatically.","platform","ai","video_content","2026-01-01T23:07:33.349Z"
"metadata extraction enriches content.","platform","general","video_content","2026-01-01T23:07:33.349Z"
"full text search finds anything instantly.","platform","general","video_content","2026-01-01T23:07:33.349Z"
"recommendation engine suggests relevant content.","platform","general","video_content","2026-01-01T23:07:33.349Z"
"notification system keeps users informed.","platform","general","video_content","2026-01-01T23:07:33.349Z"
"email integration sends important updates.","platform","ai","video_content","2026-01-01T23:07:33.349Z"
"sms alerts provide critical notifications.","platform","general","video_content","2026-01-01T23:07:33.349Z"
"push notifications engage mobile users.","platform","general","video_content","2026-01-01T23:07:33.349Z"
"webhook support enables custom integrations.","platform","general","video_content","2026-01-01T23:07:33.349Z"
"api rate limiting prevents abuse.","platform","networking","video_content","2026-01-01T23:07:33.349Z"
"api versioning maintains compatibility.","platform","networking","video_content","2026-01-01T23:07:33.349Z"
"api documentation helps developers integrate.","platform","tutorial","video_content","2026-01-01T23:07:33.349Z"
"sdk libraries simplify client development.","platform","tutorial","video_content","2026-01-01T23:07:33.349Z"
"test coverage ensures code quality.","platform","general","video_content","2026-01-01T23:07:33.349Z"
"code reviews maintain high standards.","platform","ai","video_content","2026-01-01T23:07:33.349Z"
"continuous integration catches bugs early.","platform","general","video_content","2026-01-01T23:07:33.349Z"
"automated testing validates functionality.","platform","general","video_content","2026-01-01T23:07:33.349Z"
"performance testing ensures scalability.","platform","general","video_content","2026-01-01T23:07:33.349Z"
"security audits identify vulnerabilities.","platform","security","video_content","2026-01-01T23:07:33.349Z"
"compliance checks meet regulations.","platform","general","video_content","2026-01-01T23:07:33.349Z"
"data encryption protects privacy.","platform","security","video_content","2026-01-01T23:07:33.349Z"
"access control restricts sensitive data.","platform","general","video_content","2026-01-01T23:07:33.349Z"
"audit logging tracks all actions.","platform","general","video_content","2026-01-01T23:07:33.349Z"
"backup verification ensures recoverability.","platform","general","video_content","2026-01-01T23:07:33.349Z"
"disaster recovery plans minimize downtime.","platform","general","video_content","2026-01-01T23:07:33.349Z"
"incident response procedures handle emergencies.","platform","general","video_content","2026-01-01T23:07:33.349Z"
"on-call rotation ensures coverage.","platform","general","video_content","2026-01-01T23:07:33.349Z"
"runbooks document procedures clearly.","platform","general","video_content","2026-01-01T23:07:33.349Z"
"postmortems drive continuous improvement.","platform","systems","video_content","2026-01-01T23:07:33.349Z"
"metrics dashboards show key indicators.","platform","general","video_content","2026-01-01T23:07:33.349Z"
"alerts notify teams of issues.","platform","general","video_content","2026-01-01T23:07:33.349Z"
"escalation policies ensure quick response.","platform","general","video_content","2026-01-01T23:07:33.349Z"
"chatops integrates with team workflows.","platform","general","video_content","2026-01-01T23:07:33.349Z"
"documentation keeps knowledge accessible.","platform","general","video_content","2026-01-01T23:07:33.349Z"
"training programs onboard new team members.","platform","ai","video_content","2026-01-01T23:07:33.349Z"
"code standards maintain consistency.","platform","ai","video_content","2026-01-01T23:07:33.349Z"
"design patterns solve common problems.","platform","general","video_content","2026-01-01T23:07:33.349Z"
"architecture reviews ensure scalability.","platform","general","video_content","2026-01-01T23:07:33.349Z"
"capacity planning prevents outages.","platform","general","video_content","2026-01-01T23:07:33.349Z"
"cost optimization reduces expenses.","platform","systems","video_content","2026-01-01T23:07:33.349Z"
"resource tagging organizes infrastructure.","platform","general","video_content","2026-01-01T23:07:33.349Z"
"infrastructure as code enables automation.","platform","general","video_content","2026-01-01T23:07:33.349Z"
"configuration management maintains consistency.","platform","ai","video_content","2026-01-01T23:07:33.349Z"
"secret management protects credentials.","platform","general","video_content","2026-01-01T23:07:33.349Z"
"key rotation enhances security.","platform","security","video_content","2026-01-01T23:07:33.349Z"
"certificate management automates ssl.","platform","general","video_content","2026-01-01T23:07:33.349Z"
"dns management simplifies networking.","platform","networking","video_content","2026-01-01T23:07:33.349Z"
"load testing validates performance.","platform","general","video_content","2026-01-01T23:07:33.349Z"
"stress testing finds breaking points.","platform","general","video_content","2026-01-01T23:07:33.349Z"
"chaos testing proves resilience.","platform","systems","video_content","2026-01-01T23:07:33.349Z"
"canary deployments reduce risk.","platform","general","video_content","2026-01-01T23:07:33.349Z"
"feature flags enable gradual rollout.","platform","general","video_content","2026-01-01T23:07:33.349Z"
"a b testing optimizes user experience.","platform","general","video_content","2026-01-01T23:07:33.349Z"
"user feedback drives improvements.","platform","general","video_content","2026-01-01T23:07:33.349Z"
"analytics inform decisions.","platform","general","video_content","2026-01-01T23:07:33.349Z"
"metrics measure success.","platform","general","video_content","2026-01-01T23:07:33.349Z"
"goals align efforts.","platform","general","video_content","2026-01-01T23:07:33.349Z"
"vision guides direction.","platform","general","video_content","2026-01-01T23:07:33.349Z"
"mission defines purpose.","platform","systems","video_content","2026-01-01T23:07:33.349Z"
"values shape culture.","platform","general","video_content","2026-01-01T23:07:33.349Z"
"team collaboration drives innovation.","platform","general","video_content","2026-01-01T23:07:33.349Z"
"communication keeps everyone aligned.","platform","general","video_content","2026-01-01T23:07:33.349Z"
"transparency builds trust.","platform","tutorial","video_content","2026-01-01T23:07:33.349Z"
"accountability ensures delivery.","platform","general","video_content","2026-01-01T23:07:33.349Z"
"quality never compromises.","platform","general","video_content","2026-01-01T23:07:33.349Z"
"excellence is the standard.","platform","general","video_content","2026-01-01T23:07:33.349Z"
"innovation drives progress.","platform","general","video_content","2026-01-01T23:07:33.349Z"
"reliability builds confidence.","platform","tutorial","video_content","2026-01-01T23:07:33.349Z"
"security protects users.","platform","security","video_content","2026-01-01T23:07:33.349Z"
"privacy respects individuals.","platform","general","video_content","2026-01-01T23:07:33.349Z"
"accessibility includes everyone.","platform","general","video_content","2026-01-01T23:07:33.349Z"
"performance delights users.","platform","general","video_content","2026-01-01T23:07:33.349Z"
"scalability enables growth.","platform","general","video_content","2026-01-01T23:07:33.349Z"
"efficiency reduces waste.","platform","general","video_content","2026-01-01T23:07:33.349Z"
"sustainability ensures longevity.","platform","ai","video_content","2026-01-01T23:07:33.349Z"
"community creates value.","platform","tutorial","video_content","2026-01-01T23:07:33.349Z"
"the hootner platform empowers creators worldwide.","platform","general","video_content","2026-01-01T23:07:33.349Z"
"foundational builds hardware and low level emulation","educational","tutorial","tutorial_content","2026-01-01T23:07:33.351Z"
"build your own cpu emulator tutorial series","educational","tutorial","tutorial_content","2026-01-01T23:07:33.351Z"
"learn assembly language programming from scratch","educational","systems","tutorial_content","2026-01-01T23:07:33.351Z"
"how to create a linker step by step guide","educational","tutorial","tutorial_content","2026-01-01T23:07:33.351Z"
"debugging techniques for low level code","educational","general","tutorial_content","2026-01-01T23:07:33.352Z"
"understanding machine code and disassembly","educational","systems","tutorial_content","2026-01-01T23:07:33.352Z"
"language and compilation builds","educational","tutorial","tutorial_content","2026-01-01T23:07:33.352Z"
"creating your first programming language tutorial","educational","general","tutorial_content","2026-01-01T23:07:33.352Z"
"compiler design fundamentals explained","educational","systems","tutorial_content","2026-01-01T23:07:33.352Z"
"interpreter vs compiler which to build first","educational","tutorial","tutorial_content","2026-01-01T23:07:33.352Z"
"just in time compilation deep dive","educational","general","tutorial_content","2026-01-01T23:07:33.352Z"
"garbage collection algorithms comparison","educational","general","tutorial_content","2026-01-01T23:07:33.352Z"
"regex engine implementation guide","educational","tutorial","tutorial_content","2026-01-01T23:07:33.352Z"
"building a scripting language for beginners","educational","tutorial","tutorial_content","2026-01-01T23:07:33.352Z"
"operating system and kernel builds","educational","tutorial","tutorial_content","2026-01-01T23:07:33.352Z"
"operating system development from scratch","educational","tutorial","tutorial_content","2026-01-01T23:07:33.352Z"
"writing a bootloader in assembly","educational","systems","tutorial_content","2026-01-01T23:07:33.352Z"
"microkernel vs monolithic kernel design","educational","systems","tutorial_content","2026-01-01T23:07:33.352Z"
"process scheduling algorithms explained","educational","ai","tutorial_content","2026-01-01T23:07:33.352Z"
"memory management and allocation strategies","educational","general","tutorial_content","2026-01-01T23:07:33.352Z"
"file system implementation tutorial","educational","tutorial","tutorial_content","2026-01-01T23:07:33.352Z"
"building a unix like shell","educational","tutorial","tutorial_content","2026-01-01T23:07:33.352Z"
"virtualization and runtime builds","educational","tutorial","tutorial_content","2026-01-01T23:07:33.352Z"
"virtual machine architecture overview","educational","general","tutorial_content","2026-01-01T23:07:33.352Z"
"hypervisor development guide","educational","tutorial","tutorial_content","2026-01-01T23:07:33.352Z"
"container runtime internals explained","educational","ai","tutorial_content","2026-01-01T23:07:33.352Z"
"kubernetes orchestration tutorial","educational","general","tutorial_content","2026-01-01T23:07:33.352Z"
"building a javascript runtime like nodejs","educational","tutorial","tutorial_content","2026-01-01T23:07:33.352Z"
"sandboxing untrusted code safely","educational","general","tutorial_content","2026-01-01T23:07:33.352Z"
"networking and communication builds","educational","tutorial","tutorial_content","2026-01-01T23:07:33.352Z"
"tcp ip stack implementation guide","educational","tutorial","tutorial_content","2026-01-01T23:07:33.352Z"
"building a dns server from scratch","educational","tutorial","tutorial_content","2026-01-01T23:07:33.352Z"
"software defined networking tutorial","educational","networking","tutorial_content","2026-01-01T23:07:33.352Z"
"firewall development and packet filtering","educational","tutorial","tutorial_content","2026-01-01T23:07:33.352Z"
"iot protocol design patterns","educational","networking","tutorial_content","2026-01-01T23:07:33.352Z"
"message broker architecture like kafka","educational","social","tutorial_content","2026-01-01T23:07:33.352Z"
"api gateway implementation guide","educational","tutorial","tutorial_content","2026-01-01T23:07:33.352Z"
"load balancing algorithms explained","educational","ai","tutorial_content","2026-01-01T23:07:33.352Z"
"data storage and management builds","educational","tutorial","tutorial_content","2026-01-01T23:07:33.352Z"
"relational database internals","educational","data","tutorial_content","2026-01-01T23:07:33.352Z"
"building a key value store like redis","educational","tutorial","tutorial_content","2026-01-01T23:07:33.352Z"
"nosql database design patterns","educational","systems","tutorial_content","2026-01-01T23:07:33.352Z"
"graph database implementation guide","educational","tutorial","tutorial_content","2026-01-01T23:07:33.352Z"
"distributed file system architecture","educational","general","tutorial_content","2026-01-01T23:07:33.352Z"
"orm design and implementation","educational","tutorial","tutorial_content","2026-01-01T23:07:33.352Z"
"bloom filter data structure tutorial","educational","general","tutorial_content","2026-01-01T23:07:33.352Z"
"hash table collision resolution strategies","educational","general","tutorial_content","2026-01-01T23:07:33.352Z"
"web and application server builds","educational","tutorial","tutorial_content","2026-01-01T23:07:33.352Z"
"http server implementation from scratch","educational","tutorial","tutorial_content","2026-01-01T23:07:33.352Z"
"web framework design patterns","educational","general","tutorial_content","2026-01-01T23:07:33.352Z"
"static site generator tutorial","educational","general","tutorial_content","2026-01-01T23:07:33.352Z"
"template engine internals","educational","general","tutorial_content","2026-01-01T23:07:33.352Z"
"oauth2 authentication flow explained","educational","ai","tutorial_content","2026-01-01T23:07:33.352Z"
"rate limiting strategies and algorithms","educational","general","tutorial_content","2026-01-01T23:07:33.352Z"
"background job processing with task queues","educational","general","tutorial_content","2026-01-01T23:07:33.352Z"
"browser and ui builds","educational","tutorial","tutorial_content","2026-01-01T23:07:33.352Z"
"browser rendering engine architecture","educational","graphics","tutorial_content","2026-01-01T23:07:33.352Z"
"virtual dom implementation guide","educational","tutorial","tutorial_content","2026-01-01T23:07:33.352Z"
"building a text editor from scratch","educational","tutorial","tutorial_content","2026-01-01T23:07:33.352Z"
"gui toolkit design patterns","educational","general","tutorial_content","2026-01-01T23:07:33.352Z"
"window manager development","educational","tutorial","tutorial_content","2026-01-01T23:07:33.352Z"
"ide features and implementation","educational","tutorial","tutorial_content","2026-01-01T23:07:33.352Z"
"games graphics and media builds","educational","tutorial","tutorial_content","2026-01-01T23:07:33.352Z"
"game engine architecture overview","educational","graphics","tutorial_content","2026-01-01T23:07:33.352Z"
"3d rendering pipeline explained","educational","graphics","tutorial_content","2026-01-01T23:07:33.352Z"
"physics engine implementation guide","educational","tutorial","tutorial_content","2026-01-01T23:07:33.352Z"
"audio processing fundamentals","educational","general","tutorial_content","2026-01-01T23:07:33.352Z"
"vr rendering techniques","educational","graphics","tutorial_content","2026-01-01T23:07:33.352Z"
"voxel engine like minecraft tutorial","educational","social","tutorial_content","2026-01-01T23:07:33.352Z"
"computer vision basics","educational","general","tutorial_content","2026-01-01T23:07:33.352Z"
"development tools and workflow builds","educational","tutorial","tutorial_content","2026-01-01T23:07:33.352Z"
"package manager design patterns","educational","general","tutorial_content","2026-01-01T23:07:33.352Z"
"version control system internals like git","educational","social","tutorial_content","2026-01-01T23:07:33.352Z"
"ci cd pipeline implementation","educational","tutorial","tutorial_content","2026-01-01T23:07:33.352Z"
"code profiling and optimization","educational","general","tutorial_content","2026-01-01T23:07:33.352Z"
"static analysis tool development","educational","tutorial","tutorial_content","2026-01-01T23:07:33.352Z"
"monitoring and metrics collection","educational","general","tutorial_content","2026-01-01T23:07:33.352Z"
